<?xml version="1.0" encoding="UTF-8"?>
<!DOCTYPE persons SYSTEM "persons.dtd">
<persons>
	<person id="p1">
		<gender>female</gender>
		<name>Ada</name>
		<birth>1989-11-11</birth>
		<messages>
			<message>
				<title>first</title>
				<content>This is a message</content>
			</message>
		</messages>
	</person>
	<person id="p2">
		<gender>male</gender>
		<name>Green</name>
		<birth>1989-11-11</birth>
		<messages>
			<message>
				<title>first</title>
				<content>This is a message</content>
			</message>
		</messages>
	</person>
</persons>